НАЗВАНИЕ,ДАТА ОКАНЧАНИЕ,СТАТУСЗакуп оборудования по проекту НИР Система GPC- Agress 1100 GPC System,13.11.2020 11:00,ЗАВЕРШЕНО
"Закупка товаров для ДИТ, согласно заявке № 199 Т от 10.11.2020г.",13.11.2020 10:01,ЗАВЕРШЕНО
Закуп картриджей на цветные принтера,10.11.2020 10:01,ЗАВЕРШЕНО
Закуп вышки тура и метеостанции цифровой WH1081 для обслуживания ветрогенератора,09.11.2020 11:00,ЗАВЕРШЕНО
Ремонт и калибровка двух микротвердомеров ПМТ-3М,09.11.2020 11:00,ЗАВЕРШЕНО
"Закупка услуг по организации кофе-брейков и бизнес-ланчей, согласно заявке № 186 У от 30.10.2020г.",06.11.2020 17:41,ЗАВЕРШЕНО
Закуп ноутбуков MSI Prestige 14 A10RSC-264XKZ для проекта №AP05133211,03.11.2020 16:00,ЗАВЕРШЕНО
Закуп нагревательного столика TBK-568 for 12.6’’ Tablet heater 220V и силиконовой мембраны (Silicone membrane),03.11.2020 16:00,ЗАВЕРШЕНО
"Закуп Работ по подготовке площадки для оборудования лаборатории ФГиГ, согласно заявке № 182 Р от 27.10.2020г.",30.10.2020 14:33,ЗАВЕРШЕНО
Закуп нового штампа,30.10.2020 12:11,ЗАВЕРШЕНО
Закуп товара для Службы безопасности,27.10.2020 11:50,ЗАВЕРШЕНО
Закупка услуг по созданию измерительного комплекса для проведения измерений в нанодиапазоне,27.10.2020 10:30,ЗАВЕРШЕНО
Закуп ноутбуков MSI Prestige 14 A10RSC-264XKZ для проекта №AP05133211,26.10.2020 17:00,ЗАВЕРШЕНО
Закуп товаров: ГАЗов и материалов для исследовательских работ,26.10.2020 17:00,ЗАВЕРШЕНО
Канцелярские товары для АУП,26.10.2020 12:41,ЗАВЕРШЕНО
"Закупка услуг по медицинскому страхованию для афганских женщин, согласно заявке № 143 У от 02.10.2020г.",22.10.2020 17:50,ЗАВЕРШЕНО
Закупк услуг  организации перевозок грузов по международным маршрутам,22.10.2020 17:00,ЗАВЕРШЕНО
"Закуп товара для ЭХД, согласно заявке № 162 Т от 14.10.2020г.",22.10.2020 11:50,ЗАВЕРШЕНО
Приобретение запасов санитарных товаров для ДМиС,20.10.2020 16:20,ЗАВЕРШЕНО
Компьютерная техника для ФГиГ,20.10.2020 17:21,ЗАВЕРШЕНО
Флуоресцентная фотобумага  светящаяся Acmelight Glow Paper,19.10.2020 10:21,ЗАВЕРШЕНО
Расходные материалы для ИЦ,16.10.2020 12:41,ЗАВЕРШЕНО
Перезарядка огнетушителей в ДМиС,15.10.2020 15:01,ЗАВЕРШЕНО
Компьютерная техника для ФГиГ,15.10.2020 14:46,ЗАВЕРШЕНО
Закупка рекламных услуг по таргетированной рекламе,13.10.2020 11:00,ЗАВЕРШЕНО
Закуп ГАЗов и материалов для исследовательских работ в НОЦАЭиН,13.10.2020 11:00,ЗАВЕРШЕНО
Закуп аккумуляторов для портативных радиостанций в симуляторах КМА,13.10.2020 11:00,ЗАВЕРШЕНО
Дезинфицирующее средство,08.10.2020 16:51,ЗАВЕРШЕНО
"Закупка услуг по проведению тренингов на базе ЕKK для кадетов 3 и 4 курса КМА, согласно заявке № 138 У от 29.09.2020г.",08.10.2020 14:01,ЗАВЕРШЕНО
Материалы для реставрации насосов циркуляции доводчиков ЭХД,07.10.2020 11:21,ЗАВЕРШЕНО
"Закупка услуг по питанию кадетов 3 и 4 курса КМА, согласно заявке № 139 У от 29.09.2020г.",06.10.2020 11:01,ЗАВЕРШЕНО
Закупка услуг по таргетированной рекламе для программы DBA,02.10.2020 12:46,ЗАВЕРШЕНО
Закуп услуги  по аутсорсингу персонала: для преподавания дисциплины «Английский язык» для студентов КБТУ,02.10.2020 12:42,ЗАВЕРШЕНО
Закуп сантехнических материалов для осуществления ремонта санитарного (мужского) узла на пятом этаже,01.10.2020 15:31,ЗАВЕРШЕНО
Закуп материалов для ДМиС,01.10.2020 14:01,ЗАВЕРШЕНО
"Закуп материалов для сварочных и токарных работ для НОЦАЭиН, на основании заявки №122Т от 15.09.20",29.09.2020 11:00,ЗАВЕРШЕНО
"Услуги по ремонту и сервисному обслуживанию служебного автотранспорта АО ""КБТУ"".",29.09.2020 15:25,ЗАВЕРШЕНО
Заявка на поставку материалов для ДМиС согласно заявке №129Т от 21.09.20г.,25.09.2020 12:21,ЗАВЕРШЕНО
Закуп сантехнических материалов для осуществления ремонта санитарного узла на пятом этаже согласно заявке №127Т от 21.09.20г.,24.09.2020 17:01,ЗАВЕРШЕНО
"Закуп электротоваров по заявке №120Т от 11.09.20, закуп материалов для грузчиков и плотников  №75Т от 06.08.20г.",23.09.2020 15:30,ЗАВЕРШЕНО
"Закуп материалов для сварочных и токарных работ для НОЦАЭиН, на основании заявки №122Т от 15.09.20",23.09.2020 11:00,ЗАВЕРШЕНО
"Заявка на закуп материалов/работ и услуг, по оформлению аудиторий 113-У от 10.09.2020",23.09.2020 11:00,ЗАВЕРШЕНО
"Закупка услуг по дизайну, печати и установке баннера для приемной комиссии и дезинфекционный туннель согласно заявке №107Т от 03.09.20",23.09.2020 10:30,ЗАВЕРШЕНО
Закуп ноутбука согласно заявке №125 Т от 16.09.20г.,22.09.2020 10:11,ЗАВЕРШЕНО
"Закупка услуги по переносу пульта пожарной сигнализации (ДМиС), согласно заявке № 116 У от 11.09.2020г.",18.09.2020 09:31,ЗАВЕРШЕНО
"Закупка услуги по переносу пульта пожарной сигнализации (ДМиС), согласно заявке № 116 У от 11.09.2020г.",17.09.2020 11:41,ЗАВЕРШЕНО
Электротовары для СБ согласно заявке №119Т от 11.09.20г.,16.09.2020 15:51,ЗАВЕРШЕНО
"Закупка услуги по поверке термопреобразователя прибора учета тепловой энергии  корпуса №1  (ДМиС), согласно заявке № 106 У от 03.09.2020г. поверке тепловых счетчиков ТВ7  (тепловычеслитель), РС-100 (расходометр подающий), РС-100 (расходометр обратный), КТ",16.09.2020 15:01,ЗАВЕРШЕНО
"Закупка товаров для НИИЛ НиКХ, согласно заявке № 103 Т от 03.09.2020г.",16.09.2020 12:01,ЗАВЕРШЕНО
"Закупка услуги по сервисному обслуживанию 10 прецизионных кондиционеров (ДИТ), согласно заявке №112 У от 09.09.2020г.",15.09.2020 14:01,ЗАВЕРШЕНО
Закуп сантехнических материалов для осуществления ремонта санитарного узла на пятом этаже согласно заявке №110Т от 09.09.20г.,15.09.2020 09:21,ЗАВЕРШЕНО
Закуп товара для Дома магистрантов и студентов согласно заявки №108Т от 07.09.2020,14.09.2020 13:00,ЗАВЕРШЕНО
"Закупка товаров для ДИТ, согласно заявке № 96 Т от 27.08.2020г.",11.09.2020 15:01,ЗАВЕРШЕНО
"Закупка услуги ускоренной почтовой связи (канцелярия), согласно заявке № 101 У от 01.09.2020г.",09.09.2020 10:01,ЗАВЕРШЕНО
"Закупка услуги по обслуживанию кондиционеров (ЭХД), согласно заявке № 102 У от 01.09.2020г.",09.09.2020 10:01,ЗАВЕРШЕНО
"Закуп аккумуляторных батарей и их замена, согласно заявке № 104 Т от 03.09.2020г.",08.09.2020 17:45,ЗАВЕРШЕНО
Крестовина из нержавеющей стали по чертежам,08.09.2020 15:01,ЗАВЕРШЕНО
Закуп оргстекла,08.09.2020 15:01,ЗАВЕРШЕНО
"Закупка товаров для ИЦ, согласно заявке № 100 Т от 01.09.2020г.",07.09.2020 10:01,ЗАВЕРШЕНО
"Закупка товаров для ДИТ, согласно заявке № 96 Т от 27.08.2020г.",03.09.2020 15:01,ЗАВЕРШЕНО
Оборудование для ДИТ,02.09.2020 15:01,ЗАВЕРШЕНО
"Ноутбуков, графических планшетов, интернет камер и моноблока (25.08.2020)",28.08.2020 15:01,ЗАВЕРШЕНО
Закуп материалов для плотника и грузчиков,28.08.2020 00:00,ЗАВЕРШЕНО
